{
  "$schema": "https://json-schema.org/draft/2020-12/schema",
  "properties": {
    "overview": {
      "properties": {
        "objective": {
          "type": "string",
          "minLength": 1
        },
        "context": {
          "type": "string",
          "minLength": 1
        },
        "problem": {
          "properties": {
            "text": {
              "type": "string",
              "minLength": 1
            },
            "loop": {
              "properties": {
                "cmd": {
                  "type": "string",
                  "minLength": 1
                },
                "text": {
                  "type": "string"
                }
              },
              "additionalProperties": false,
              "type": "object",
              "required": [
                "cmd",
                "text"
              ]
            },
            "repro": {
              "type": "string"
            },
            "hypotheses": {
              "items": {
                "properties": {
                  "rank": {
                    "type": "integer",
                    "maximum": 5,
                    "minimum": 1
                  },
                  "cause": {
                    "type": "string",
                    "minLength": 1
                  },
                  "prediction": {
                    "type": "string",
                    "minLength": 1
                  }
                },
                "additionalProperties": false,
                "type": "object",
                "required": [
                  "rank",
                  "cause",
                  "prediction"
                ]
              },
              "type": "array",
              "maxItems": 5
            }
          },
          "additionalProperties": false,
          "type": "object",
          "required": [
            "text"
          ]
        },
        "goals": {
          "items": {
            "type": "string"
          },
          "type": "array",
          "minItems": 1
        },
        "nongoals": {
          "items": {
            "type": "string"
          },
          "type": "array",
          "minItems": 1
        }
      },
      "additionalProperties": false,
      "type": "object",
      "required": [
        "objective",
        "context",
        "problem",
        "goals",
        "nongoals"
      ]
    },
    "design": {
      "properties": {
        "demo": {
          "properties": {
            "cmd": {
              "type": "string",
              "minLength": 1
            },
            "text": {
              "type": "string",
              "minLength": 1
            }
          },
          "additionalProperties": false,
          "type": "object",
          "required": [
            "cmd",
            "text"
          ]
        },
        "shape": {
          "type": "string",
          "minLength": 1
        },
        "changes": {
          "items": {
            "properties": {
              "path": {
                "type": "string"
              },
              "symbol": {
                "type": "string"
              },
              "kind": {
                "type": "string",
                "enum": [
                  "new",
                  "modified"
                ]
              },
              "callers": {
                "type": "string",
                "minLength": 1
              },
              "callees": {
                "type": "string",
                "minLength": 1
              },
              "before": {
                "type": "string"
              },
              "after": {
                "type": "string",
                "minLength": 1
              },
              "simple_call": {
                "type": "string"
              }
            },
            "additionalProperties": false,
            "type": "object",
            "required": [
              "path",
              "symbol",
              "kind",
              "callers",
              "callees",
              "before",
              "after"
            ]
          },
          "type": "array"
        },
        "types": {
          "items": {
            "properties": {
              "name": {
                "type": "string"
              },
              "file": {
                "type": "string"
              },
              "kind": {
                "type": "string",
                "enum": [
                  "new",
                  "modified"
                ]
              },
              "fields": {
                "items": {
                  "properties": {
                    "name": {
                      "type": "string"
                    },
                    "type": {
                      "type": "string"
                    },
                    "required": {
                      "type": "boolean"
                    },
                    "default": {
                      "type": "string"
                    },
                    "constraints": {
                      "type": "string"
                    }
                  },
                  "additionalProperties": false,
                  "type": "object",
                  "required": [
                    "name",
                    "type",
                    "required",
                    "default",
                    "constraints"
                  ]
                },
                "type": "array",
                "minItems": 1
              },
              "transitions": {
                "items": {
                  "properties": {
                    "from": {
                      "type": "string"
                    },
                    "to": {
                      "type": "string"
                    },
                    "when": {
                      "type": "string"
                    }
                  },
                  "additionalProperties": false,
                  "type": "object",
                  "required": [
                    "from",
                    "to",
                    "when"
                  ]
                },
                "type": "array"
              }
            },
            "additionalProperties": false,
            "type": "object",
            "required": [
              "name",
              "file",
              "kind",
              "fields",
              "transitions"
            ]
          },
          "type": "array"
        },
        "migrations": {
          "properties": {
            "migrations": {
              "items": {
                "properties": {
                  "file": {
                    "type": "string"
                  },
                  "schema": {
                    "type": "string",
                    "minLength": 1
                  },
                  "backfill": {
                    "type": "string",
                    "minLength": 1
                  },
                  "locks": {
                    "type": "string",
                    "minLength": 1
                  },
                  "compat": {
                    "type": "string",
                    "minLength": 1
                  },
                  "rollback": {
                    "type": "string",
                    "minLength": 1
                  }
                },
                "additionalProperties": false,
                "type": "object",
                "required": [
                  "file",
                  "schema",
                  "backfill",
                  "locks",
                  "compat",
                  "rollback"
                ]
              },
              "type": "array"
            }
          },
          "additionalProperties": false,
          "type": "object",
          "required": [
            "migrations"
          ]
        }
      },
      "additionalProperties": false,
      "type": "object",
      "required": [
        "demo",
        "shape",
        "changes",
        "types",
        "migrations"
      ]
    },
    "delivery": {
      "properties": {
        "files": {
          "items": {
            "properties": {
              "path": {
                "type": "string"
              },
              "action": {
                "type": "string",
                "enum": [
                  "create",
                  "modify",
                  "delete"
                ]
              },
              "task": {
                "type": "string",
                "pattern": "^[1-9][0-9]?( [1-9][0-9]?)*$"
              },
              "reason": {
                "type": "string",
                "minLength": 1
              }
            },
            "additionalProperties": false,
            "type": "object",
            "required": [
              "path",
              "action",
              "reason"
            ]
          },
          "type": "array",
          "minItems": 1
        },
        "deletions": {
          "properties": {
            "deletions": {
              "items": {
                "properties": {
                  "path": {
                    "type": "string"
                  },
                  "symbol": {
                    "type": "string"
                  },
                  "existed_because": {
                    "type": "string",
                    "pattern": "existed because"
                  }
                },
                "additionalProperties": false,
                "type": "object",
                "required": [
                  "path",
                  "symbol",
                  "existed_because"
                ]
              },
              "type": "array"
            }
          },
          "additionalProperties": false,
          "type": "object",
          "required": [
            "deletions"
          ]
        },
        "tests": {
          "items": {
            "properties": {
              "name": {
                "type": "string",
                "minLength": 1
              },
              "seam": {
                "type": "string",
                "minLength": 1
              },
              "kind": {
                "type": "string",
                "enum": [
                  "integration",
                  "unit",
                  "regression",
                  "e2e"
                ]
              },
              "mocks": {
                "type": "string"
              },
              "asserts": {
                "type": "string",
                "minLength": 1
              }
            },
            "additionalProperties": false,
            "type": "object",
            "required": [
              "name",
              "seam",
              "kind",
              "mocks",
              "asserts"
            ]
          },
          "type": "array",
          "minItems": 1
        },
        "tasks": {
          "items": {
            "properties": {
              "n": {
                "type": "integer",
                "maximum": 12,
                "minimum": 1
              },
              "test": {
                "type": "string",
                "minLength": 1
              },
              "demo": {
                "type": "boolean"
              },
              "text": {
                "type": "string",
                "minLength": 1
              }
            },
            "additionalProperties": false,
            "type": "object",
            "required": [
              "n",
              "test",
              "demo",
              "text"
            ]
          },
          "type": "array",
          "maxItems": 12,
          "minItems": 1
        }
      },
      "additionalProperties": false,
      "type": "object",
      "required": [
        "files",
        "deletions",
        "tests",
        "tasks"
      ]
    },
    "review": {
      "properties": {
        "trust_root": {
          "type": "string",
          "minLength": 1
        },
        "alternatives": {
          "items": {
            "type": "string"
          },
          "type": "array",
          "minItems": 1
        },
        "risks": {
          "items": {
            "type": "string"
          },
          "type": "array",
          "minItems": 1
        }
      },
      "additionalProperties": false,
      "type": "object",
      "required": [
        "trust_root",
        "alternatives",
        "risks"
      ]
    },
    "dispositions": {
      "items": {
        "properties": {
          "finding": {
            "type": "string",
            "pattern": "^p[0-9]+-f[0-9]+$"
          },
          "kind": {
            "type": "string",
            "enum": [
              "fixed",
              "disputed"
            ]
          },
          "path": {
            "type": "string"
          },
          "reason": {
            "type": "string"
          }
        },
        "additionalProperties": false,
        "type": "object",
        "required": [
          "finding",
          "kind"
        ]
      },
      "type": "array"
    }
  },
  "additionalProperties": false,
  "type": "object",
  "required": [
    "overview",
    "design",
    "delivery",
    "review"
  ]
}
